Course Number,Course Title,Subject,Tag 1,Tag 2,Tag 3,Tag 4,Tag 5,,,,
HISTORY 211 / MEMS 211,"Later Medieval Europe, 1000-1500",HISTORY,Medieval political developments,Economic and religious history,Intellectual movements,Western Christendom focus,Medieval thought,,,,
HISTORY 216,War and Society in the 20th Century: World War I,HISTORY,World War I causes,War impact on society,Cultural memory,Literary and art perspectives,Colonial world context,,,,
HISTORY 227,The Rise and Fall of the British Empire,HISTORY,British Empire expansion,Colonial experiences,Social and cultural dimensions,Economic impacts,Empire decline analysis,,,,
HISTORY 228 / ANTHRCUL 317 / POLSCI 334 / REEES 397 / SLAVIC 397 / SOC 317,Communism and Capitalism in Eastern Europe,HISTORY,Eastern Europe political history,State socialism analysis,Revolutions of 1989,Post-communist transition,Economic and cultural shifts,,,,
HISTORY 229 / ANTHRCUL 226,Introduction to Historical Anthropology,HISTORY,Historical memory systems,Cultural memory analysis,Commemoration practices,Race and gender perspectives,National identity,,,,
HISTORY 230,Humanities Topics in History,HISTORY,Thematic historical topics,Interdisciplinary humanities,Non-specific country focus,Repeatable for credit,Variable course content,,,,
HISTORY 231,Social Science Topics in History,HISTORY,Social science in history,Thematic exploration,Non-specific country focus,Repeatable for credit,Variable course content,,,,
HISTORY 235 / POLSCI 316,Histories of Law and Social Justice,HISTORY,Legal history and justice,Social movement analysis,Anti-slavery and voting rights,Environmental law,Justice in legal practices,,,,
HISTORY 237 / ENVIRON 237 / STS 237,Global Environmental History,HISTORY,Environmental history introduction,Human-nature interactions,Ecological perspectives,Global historical issues,Human agency in history,,,,
HISTORY 240,The World Since 1492,HISTORY,Global history overview,Transnational developments,Cultural exchanges,Post-1492 focus,Transregional analysis,,,,
HISTORY 247 / AAS 247 / INTLSTD 247,Modern Africa,HISTORY,Sub-Saharan Africa history,Slave trade abolition,European imperialism,Nationalism and decolonization,Modern African issues,,,,
HISTORY 251 / ASIAN 241,The Chinese Renaissance: Cultural Transformations in Eleventh-Century China,HISTORY,Song Empire cultural achievements,Philosophical developments,Artistic and technological advances,Comparative renaissance study,Primary sources analysis,,,,
HISTORY 254,"Europe, 1648-Present: Legacies of War, Empire, and Revolution",HISTORY,European history post-1648,Revolutions and nationalism,War and imperialism,20th-century conflicts,Political and social change,,,,
HISTORY 261,"United States, 1865 to the Present",HISTORY,Post-Civil War U.S. history,Political and social change,Race and immigration,20th-century conflicts,Cultural developments,,,,
HISTORY 272 / AAS 262,20th Century African-American Social Movements,HISTORY,Civil Rights Movement origins,Equality and racial justice,Strategies for social change,Post-civil rights debates,U.S. policy on race,,,,
HISTORY 280,The Civil War Era in U.S. History,HISTORY,Civil War social and political history,Reconstruction period,19th-century America,Primary source focus,Cultural impact of the war,,,,
HISTORY 285 / RCSSCI 275 / STS 285,"Science, Technology, Medicine, and Society",HISTORY,Critical STEM analysis,Society and technology impact,Cultural contexts of science,Medicine and society interaction,Modern technological influence,,,,
HISTORY 291,A World History of Happiness: Care of the Self from the Greeks to the Sufis,HISTORY,History of happiness concepts,Philosophical traditions,Positive psychology and Buddhism,Ancient Greek philosophy,Sufism and self-care,,,,
HISTORY 292 / CLCIV 392 / STS 392,Ancient Medicine in Greece & Rome,HISTORY,Greco-Roman medical theories,Ancient surgery and pharmacology,Pathology and anatomy,Ethics in ancient medicine,Western medicine foundations,,,,
HISTORY 300 / INTLSTD 300,Human Wrongs and Human Rights: History and Practice of Human Rights,HISTORY,Human rights origins,Global institutions and frameworks,Impact of atrocities,Universality debates,Institutional responses,,,,
HISTORY 307 / ISLAM 320 / MIDEAST 320,"History of the Ottoman Empire: The ""Post-Classical Age"", (ca. 1600-1922)",HISTORY,Ottoman Empire history,Post-Classical Ottoman era,Suleyman the Magnificent,Decline and collapse,1600-1922 Ottoman period,,,,
HISTORY 308 / MIDEAST 336 / RELIGION 350,The Earliest Christians,HISTORY,Church Fathers' writings,Unity of God debates,Christian scripture interpretation,Role of church in society,Early Christianity themes,,,,
HISTORY 314 / FRENCH 345,"Empire, War, and Modernity: France and the World in the 20th Century",HISTORY,20th-century France,Colonialism and decolonization,Autobiographical perspectives,French social conflicts,War and modernity in France,,,,
HISTORY 321,Culture and Politics in Britain Since 1945,HISTORY,Post-WWII Britain,Social and political movements,Cold War and welfare state,Decolonization and multiculturalism,Class and cultural debates,,,,
HISTORY 322 / GERMAN 322 / JUDAIC 322,The Origins of Nazism,HISTORY,Weimar Republic culture,Nazi ideology and rise,Consent and resistance,Genocide and persecution,Everyday life under Nazism,,,,
HISTORY 328,Humanities Topics in History,HISTORY,Humanities historical perspectives,Variable topics,Interdisciplinary focus,Cross-cultural themes,Historical analysis methods,,,,
HISTORY 329,Social Science Topics in History,HISTORY,Social science perspectives,Variable historical topics,Analytical approaches,Interdisciplinary themes,Cultural and social focus,,,,
HISTORY 338 / AMCULT 338 / NATIVEAM 338,Topics in Native American History,HISTORY,Native American history,1890 to present,Cultural and social dynamics,Contemporary issues,Indigenous perspectives,,,,
HISTORY 339,Heroes and Superheroes in U.S. Popular Culture,HISTORY,U.S. nationalism and identity,Heroes in media,Gender and racial representation,Social influence of superheroes,1840-present U.S. pop culture,,,,
HISTORY 343 / AMCULT 341,Rise of the Corporation,HISTORY,American corporate history,Entrepreneurship and capitalism,Economic and technological growth,Labor and capital relations,Corporate influence evolution,,,,
HISTORY 346 / AMCULT 348,History of American Radicalism,HISTORY,Abolitionism and early feminism,Labor and civil rights activism,20th-century leftist movements,Antiwar and liberation struggles,Modern anti-globalization,,,,
HISTORY 348 / INTLSTD 348,Latin America: The National Period,HISTORY,Latin American development,National identity and growth,Current regional challenges,Post-colonial transformation,Social and economic conditions,,,,
HISTORY 356 / RCSTP 356,Histories of Race and Law,HISTORY,Racial inequality in U.S. law,Laws reinforcing segregation,Historical racial tensions,Legal barriers to equality,Civil rights and justice,,,,
HISTORY 384 / JUDAIC 388,Antisemitism and Philosemitism: Jews in Myth and Thought,HISTORY,Antisemitic stereotypes,Philosemitism analysis,Influential modern perspectives,Jewish cultural myths,Patterns in prejudice,,,,
HISTORY 388 / AAS 323 / WGS 323,Black Feminist Thought and Practice,HISTORY,20th-century black feminism,Intersectionality of race and gender,Black feminist theories,Activism and social justice,Hip hop and transnational feminism,,,,
HISTORY 390,Topics Mini-Course,HISTORY,Specialized historical topics,Short-duration course,Interdisciplinary focus,Variable historical themes,1-2 credit mini-course,,,,
HISTORY 395,Reading Course,HISTORY,Independent study,Personalized reading program,History concentrators only,Individual faculty mentorship,Credit flexibility,,,,
HISTORY 396 / AAS 395 / GERMAN 396,Germany and the Black Diaspora,HISTORY,Black Diaspora in Germany,Cultural exchange and identity,Impact of historical contact,Race relations in Europe,German-African interactions,,,,
HISTORY 407,Advanced Study in Comparative and Transnational History,HISTORY,Comparative history,Transnational connections,Interdisciplinary approach,Capstone for International Studies,Cross-national historical themes,,,,
HISTORY 417 / GERMAN 402,Twentieth-Century German and European Thought,HISTORY,European intellectual movements,Political and cultural thought,20th-century philosophy,"Socialism, existentialism, and feminism",Modern ideological shifts,,,,
HISTORY 430 / ANTHRCUL 430 / MIDEAST 480,"History, Memory, and Silence in the Middle East",HISTORY,Memory and silence in history,Anthropological methods,Historical trauma and destruction,Genocide and refugee histories,Memory politics in the Middle East,,,,
HISTORY 434 / POLSCI 434,"Russia/USSR in the 20th and 21st Centuries: War, Revolution, and Reform",HISTORY,Bolshevik political history,Revolution and reform in Russia,20th and 21st-century Russia,Social and economic developments,World War impacts on Russia,,,,
HISTORY 436 / CLCIV 436,From Caesar to Augustus: Rome's Triumviral Period,HISTORY,Roman history and politics,Triumvirate of Rome,Octavian and Mark Antony,"Art, literature, and religion in Rome",Political transformation post-Caesar,,,,
HISTORY 441,Topics in History: HistoryLabs I,HISTORY,Project-based history learning,Collaborative history research,Primary and secondary material analysis,Team-based historical exploration,Variable history topics,,,,
HISTORY 447 / MEMS 442 / SCAND 442,"The Icelandic Sagas: Vikings, Women, and Vengeance",HISTORY,Icelandic sagas and literature,Viking culture and mythology,Gender roles in medieval Iceland,Feuds and vengeance in sagas,Sagas as historical sources,,,,
HISTORY 449,Topics in Middle Eastern History,HISTORY,Middle Eastern history,Variable historical themes,Political and cultural developments,Focus on regional history,Regional historical dynamics,,,,
HISTORY 450 / ASIAN 450,Japan to 1700: Origin Myth to Shogun Dynasty,HISTORY,Japanese history and origins,Imperial family development,Samurai and legal culture,Economic and gender shifts,Multi-belief religious systems,,,,
HISTORY 468,Topics in U.S. History,HISTORY,U.S. history topics,Variable historical themes,Specific focus each term,American historical aspects,Recurrent thematic analysis,,,,
HISTORY 472,Topics in Asian History,HISTORY,Asian history topics,Variable historical themes,Region-specific focus,Recurrent thematic exploration,Focus on Asian perspectives,,,,
HISTORY 475,History of Socialism,HISTORY,Socialism as ideology,History of socialism worldwide,Systemic transformations,State socialism case studies,Socialism vs. capitalism,,,,
HISTORY 481,Topics in European History,HISTORY,European history topics,Variable historical themes,Specific focus each term,European historical perspectives,Recurrent thematic study,,,,
HISTORY 491,Topics in History: HistoryLabs II,HISTORY,Project-based history learning,Team collaboration in research,Primary and secondary sources,History colloquium requirement,Variable topics and themes,,,,
HISTORY 496,History Colloquium,HISTORY,Intensive historical problems,Critical reading and discussion,Philosophy of history topics,Upper-Level-Writing Requirement,Small seminar format,,,,
HISTORY 497,History Colloquium,HISTORY,In-depth historical problems,Critical analysis and discussion,Philosophy of history,Small class structure,Upper-Level-Writing Requirement,,,,
HISTORY 498,Junior Honors Colloquium,HISTORY,Honors thesis preparation,Historical philosophy studies,Introduction to historical research,Junior Honors students,Research and writing focus,,,,
HISTORY 499,Senior Honors Colloquium,HISTORY,Senior thesis workshop,Research and writing skills,Methodological issues,Independent research guidance,History Honors program,,,,
HONORS 230,Honors Core in Social Science,HONORS,Introduction to social sciences,Interdisciplinary methodologies,Theoretical concepts and problems,Case studies and applications,Honors Core Curriculum,,,,
HONORS 241,Honors Core Writing in Humanities,HONORS,Academic writing in humanities,Interdisciplinary humanities topics,Critical analysis and discussion,Extra-disciplinary approach,Honors Core Curriculum,,,,
HONORS 290,Honors Introduction to Research,HONORS,Independent guided study,Research skills development,Professor-directed study,For juniors and seniors,Honors independent research,,,,
HONORS 291,Honors Introduction to Scientific Research,HONORS,Scientific research introduction,Independent research skills,Faculty-supervised study,Lab techniques and methods,Open to Honors students,,,,
HONORS 292,Honors Introduction to Scientific Research,HONORS,Basic research skills,Laboratory experience,Faculty-supervised learning,Scientific techniques training,Honors Program,,,,
HONORS 390,Junior Honors Research,HONORS,Junior-level Honors research,Independent study with faculty,Research and reading for Honors,Work-in-progress grading,Honors junior research project,,,,
HONORS 490,Senior Honors Research,HONORS,Senior thesis preparation,Independent research project,Faculty-supervised thesis,Research and writing process,Honors senior research course,,,,
INSTHUM 311,Topics in Interdisciplinary Studies,INSTHUM,Advanced interdisciplinary seminar,Resident Fellow instruction,Cross-disciplinary topics,Topics vary by term,For advanced undergraduates,,,,
INTLSTD 101 / GEOG 145,Introduction to International Studies,INTLSTD,Global flows and exchanges,Historical impact analysis,Political and cultural borders,Cross-border dynamics,Career context in global issues,,,,
INTLSTD 170,International Studies Special Topics,INTLSTD,Interdisciplinary international topics,Flexible credit/no credit,Major-relevant themes,Non-LSA faculty instruction,International Studies curriculum,,,,
INTLSTD 209 / HISTORY 209 / RELIGION 209 / STS 209,"Death, Immortality, and Afterlife",INTLSTD,Humanity and mortality exploration,Multidisciplinary approach,Anthropology and history focus,Cross-species perspective,Universal death themes,,,,
INTLSTD 247 / AAS 247 / HISTORY 247,Modern Africa,INTLSTD,Sub-Saharan African history,Slave trade abolition,European imperialism effects,Nationalism and decolonization,Contemporary African themes,,,,
INTLSTD 270,International Studies Special Topics,INTLSTD,Flexible interdisciplinary topics,International Studies focus,Courses from various units,Major/minor requirement options,Cross-departmental instruction,,,,
INTLSTD 300 / HISTORY 300,Human Wrongs and Human Rights,INTLSTD,History of human rights,Institutional and legal frameworks,Global atrocities study,Universality of rights debate,Response to human wrongs,,,,
INTLSTD 308 / MENAS 308 / MIDEAST 308,Conflict and Comics: Reframing the Middle East,INTLSTD,Middle East in comics,Political conflict depiction,Journalistic and autobiographical genres,Graphic storytelling impact,Cultural perspectives in comics,,,,
INTLSTD 348 / HISTORY 348,Latin America: The National Period,INTLSTD,National development focus,Contemporary Latin American conditions,Social and political transformations,National identity themes,Repeatable course credit,,,,
INTLSTD 352 / RCSTP 352,Global Workers' Rights,INTLSTD,Global labor rights challenges,Regulation and advocacy methods,Social science research focus,Local context of workers' rights,Labor protests and movements,,,,
INTLSTD 373 / POLSCI 373,Data Science for International Studies,INTLSTD,Scientific method in data science,Programming for social science,Causal inference techniques,International political data analysis,Quantitative research methods,,,,
INTLSTD 384,International and/or Comparative Topics in the Humanities,INTLSTD,Comparative humanities focus,International themes,Variable topics,Interdisciplinary approach,Repeatable with new topics,,,,
INTLSTD 385,International and/or Comparative Topics in the Social Sciences,INTLSTD,Social science perspectives,International comparison,Variable topics,Interdisciplinary studies,Repeatable with new topics,,,,
INTLSTD 386,"Topics in International Security, Norms, and Cooperation",INTLSTD,International security focus,Global norms analysis,Cooperation strategies,Advanced social science topics,Repeatable with new topics,,,,
INTLSTD 391,Directed Studies,INTLSTD,Independent study option,Faculty-directed research,Customizable topics,Research experience,Repeatable for additional credit,,,,
INTLSTD 399,International Studies Undergraduate Internship,INTLSTD,Practical internship experience,Career exploration,Credit/no credit grading,Integration of fieldwork and study,Repeatable with new internships,,,,
INTLSTD 401,International Studies Advanced Seminar,INTLSTD,Advanced interdisciplinary seminar,International significance focus,Junior standing or above,Repeatable with new topics,Multi-perspective analysis,,,,
INTLSTD 441 / AAS 441 / POLSCI 441,Political Violence in Africa,INTLSTD,Political violence in Africa,Focus on intra-state conflict,Theoretical and empirical approaches,Non-endemic violence discussion,Single-term seminar,,,,
INTLSTD 450 / MIDEAST 450 / WGS 450,Transnational Feminisms,INTLSTD,Transnational feminist theory,Postcolonial and global perspectives,Historical feminist roots,Women of color focus,Emphasis on global South activism,,,,
INTLSTD 470,International Studies: Special Topics,INTLSTD,Special topics in international studies,Interdisciplinary content,Department consent required,Variable credit,Repeatable with new topics,,,,
INTLSTD 491,Directed Studies,INTLSTD,Independent research opportunity,Faculty-guided study,Prerequisites in Intlstd 101 and 301,Customizable topics,Repeatable with new projects,,,,
INTLSTD 499,Senior Honors Proseminar,INTLSTD,Senior honors thesis preparation,Honors students only,Capstone research seminar,Completion of Intlstd 498 required,Single-term credit,,,,
IOE 265,Probability and Statistics for Engineers,IOE,Probability and statistics basics,Engineering-focused applications,Discrete and continuous distributions,Point and interval estimation,Hypothesis testing for populations,,,,
IOE 466 / MFG 466,Statistical Quality Control,IOE,Statistical quality control,Control charts and process control,Multivariate and autocorrelation analysis,Acceptance sampling methods,International quality standards,,,,
IOE 510 / MATH 561 / TO 518,Linear Programming I,IOE,Linear programming fundamentals,Simplex algorithm and duality theory,Postoptimality and sensitivity analysis,Transportation and assignment problems,Advanced computational techniques,,,,
IOE 511 / MATH 562,Continuous Optimization Methods,IOE,Continuous optimization methods,Unconstrained and constrained optimization,Gradient and Newton-based methods,Penalty transformations and Lagrangians,Algorithmic applications in optimization,,,,
IOE 570 / STATS 570,Experimental Design,IOE,Experimental design principles,Analysis of variance (ANOVA),Factorial and fractional factorial designs,Response surface methodology,Robust parameter design,,,,
ISLAM 246 / ANTHRCUL 246 / RELIGION 246,Anthropology of Religion,ISLAM,Fundamental issues in religion,"Life and death, good and evil",Global religious case studies,Religious tolerance and faith,Anthropological perspectives on religion,,,,
ISLAM 315 / MIDEAST 315,Introduction to Arab Culture,ISLAM,Arab cultural diversity,Historical and social contexts,Religious and political influences,Ethnic diversity in the Arab world,Arab identity and regional diversity,,,,
ISLAM 320 / HISTORY 307 / MIDEAST 320,"History of the Ottoman Empire: The ""Post-Classical Age",ISLAM,Ottoman Empire history,Suleyman the Magnificent era,Post-Classical Age (1600-1922),Political and cultural developments,Empires decline and dissolution,,,,
ISLAM 323 / MIDEAST 323,The Prophet Muhammad in Islam,ISLAM,Life of Prophet Muhammad,Islamic traditions and historiography,Prophet veneration practices,Modern Muslim perspectives,Western interpretations of Islam,,,,
ISLAM 378 / AMAS 378 / AMCULT 382 / ENGLISH 378,Muslim and Arab Literatures,ISLAM,Contemporary Muslim literature,Arab authors and narratives,Literary themes and genres,Global perspectives on Muslim identity,Modern Muslim American literature,,,,
ISLAM 390,Topics in Islamic Studies,ISLAM,Islamic culture exploration,Global Muslim societies,Interdisciplinary Islamic topics,Cultural and historical analysis,Variable topics in Islam studies,,,,
ITALIAN 101,Elementary Italian,ITALIAN,Introductory Italian language,Basic communication skills,Reading and writing practice,Everyday conversational contexts,No prior Italian required,,,,
ITALIAN 102,Elementary Italian,ITALIAN,Fundamental Italian vocabulary,Basic grammar structures,Oral practice and drills,Contemporary Italian culture,Language lab integration,,,,
ITALIAN 231,Second-Year Italian,ITALIAN,Intermediate Italian skills,Speaking and listening focus,Reading Italian literature,Italian cultural context,Journalistic prose exposure,,,,
ITALIAN 232,"Second-Year Italian, Continued",ITALIAN,Advanced beginner Italian,Improved conversational fluency,Oral comprehension practice,Reading and writing skills,Cultural proficiency in Italian,,,,
ITALIAN 235,Advanced Practice in Italian I,ITALIAN,Advanced Italian grammar,Italian language structures,Grammar-intensive activities,Conducted in Italian,Expanded reading materials,,,,
ITALIAN 300,Advanced Composition and Conversation,ITALIAN,Advanced Italian writing skills,Conversational Italian practice,Italian composition techniques,Improved oral fluency,Conducted in Italian,,,,
ITALIAN 320,Modern Italian Studies,ITALIAN,20th-21st century Italian culture,Italian literary analysis,Contemporary Italian writers,Reading and discussion,Twice for credit option,,,,
ITALIAN 333 / MEMS 333,Dante's Divine Comedy,ITALIAN,Dantes Divine Comedy study,Medieval culture context,Classical and medieval themes,Bi-lingual text editions,Taught in English,,,,
ITALIAN 415,Topics in Italian Studies,ITALIAN,Upper-level Italian studies,Italian literature and cinema,Cultural studies focus,Taught in English,Repeatable for credit,,,,
ITALIAN 499,Advanced Independent Study,ITALIAN,Custom Italian study,Independent research,Graduate and advanced undergraduates,Departmental special topics,Repeatable for credit,,,,
JAZZ 467,Jazz Improvistn II,JAZZ,Advanced jazz improvisation,Improvisation techniques,Musicianship development,Instructor consent required,Repeatable for credit,,,,
JUDAIC 102 / GERMAN 128 / YIDDISH 102,First Year Yiddish II,JUDAIC,Elementary Yiddish skills,Yiddish speaking and comprehension,Reading and writing practice,Take-home quizzes,Final creative project,,,,
JUDAIC 202 / GERMAN 228 / YIDDISH 202,Second Year Yiddish II,JUDAIC,Intermediate Yiddish fluency,Oral and written comprehension,Yiddish cultural context,Emphasis on reading,Advanced language sequence,,,,
JUDAIC 218,Humanities Topics in Judaism,JUDAIC,Introductory Judaic topics,Philosophy and film,Political science and history,Interdisciplinary focus,Lower-level undergraduates,,,,
JUDAIC 258 / ENGLISH 258 / RELIGION 258,The Bible as Literature,JUDAIC,Biblical Studies,Literature,Religion & Identity,Faith,Old & New testament,,,,
JUDAIC 281 / MIDEAST 281 / SLAVIC 281,"Jews in the Modern World: Texts, Images, Ideas",JUDAIC,Jewish History,Jewish Culture,Literary Analysis,Freedom and Persecution,Religion & Identity,,,,
JUDAIC 310,Experiential Learning in Judaic Studies,JUDAIC,Judaic Studies,Experiential Learning,Nonprofit Work,Field placement,Workplace Preparation,,,,
JUDAIC 318,Humanities Topics in Judaism,JUDAIC,Judaic Studies,Faculty Supervision,Philosophy,Film & Literature,history and political studies,,,,
JUDAIC 322 / GERMAN 322 / HISTORY 322,The Origins of Nazism,JUDAIC,Nazi seizure of power,Weimar Republic analysis,Racial state ideology,Consent vs. resistance,Cultural and historical sources,,,,
JUDAIC 331 / GERMAN 335 / SLAVIC 331,Jewish Languages,JUDAIC,Jewish language diversity,Zionism and ideology,Holocaust memory,Hebrew and Yiddish,Jewish cultural history,,,,
JUDAIC 342 / RELIGION 342,Jerusalem: One City Three Faiths,JUDAIC,History of Jerusalem,Juadism,Christianity,Islam,Religion & Identity,,,,
JUDAIC 351 / DUTCH 351,Anne Frank in Context,JUDAIC,Holocaust Studies,Anti-Semitism and Discrimination,Anne Frank's Diary,Bystander Dynamics,Jewish History in Amsterdam,,,,
JUDAIC 376 / WGS 376,Women and the Bible,JUDAIC,Biblical Studies,Religion & Ethnicity,Feminist Literature,Language,Gender Studies,,,,
JUDAIC 377,Biblical Masculinities,JUDAIC,Judaic Studies,Gender Ideals,Biblical Studies,Literary and art perspectives,Christianity,,,,
JUDAIC 388 / HISTORY 384,Antisemitism and Philosemitism: Jews in Myth and Thought,JUDAIC,Modern Civilization,Judaic Studies,Myths and ideas,Modern thought,Religion & Identity,,,,
JUDAIC 417,Topics in Judaic Studies,JUDIAC,Advanced undergraduate studies,Literature & Law,History & Political Science,Judaic Studies,Textual Analysis,,,,
JUDAIC 441,The History of Jews at the University of Michigan: Exclusion and Inclusion in American Higher Education,JUDAIC,University of Michigan History,American Judaism,Higher Education,Research Tools,History of Learning,,,,
JUDAIC 495,Independent Studies,JUDAIC,Independent Studies,Hands on Learning,Judaic Studies,Research,Jewish Liberal Arts,,,,
JUDAIC 496,Independent Studies,JUDAIC,Independent Studies,Hands on Learning,Judaic Studies,Research,Jewish Liberal Arts,,,,
Judaic 498,Senior Thesis,JUDAIC,Senior Thesis,Independent Study,Hands-on learning,Research,Judaic Studies,,,,
KRSTD 290,Topics in Korean Studies,KRSTD,Korean Culture,Korean society,Korean studies,Geography,History,,,,
KRSTD 390,Special Topics in Korean Studies,KRSTD,Special topics,Korean culture,Koran society,Korean studies,Language & Art,,,,
KRSTD 472,"Nam Center Undegraduate Fellows Research Seminar, II",KRSTD,Korean Studies,Student Discussion,Korean Culture,Korean Society,Geography,,,,
LACS 321,Social Science Topics in LACS,LACS,Latin American Studies,Caribbean Studies,Social Sciences,Special Topics,Exploratory Learning,,,,
