Course Number,Course Title,Subject,Tag 1,Tag 2,Tag 3,Tag 4,Tag 5,,,,
PSYCH 240 / NEURO 240,Introduction to Cognitive Psychology,PSYCH,Cognitive psychology,Perception and memory,Learning and reasoning,Decision making,Problem-solving theory,,,,
PSYCH 242 / COGSCI 209 / LING 209,Language and Human Mind,PSYCH,Language and cognition,Human language study,Cognitive psychology,Linguistic theory,Language mechanisms,,,,
PSYCH 250,Introduction to Developmental Psychology,PSYCH,Developmental psychology,Human growth milestones,Cognitive and emotional development,Child and adult development,Influences on development,,,,
PSYCH 270,Introduction to Abnormal Psychology,PSYCH,Abnormal psychology,Psychological disorders,Behavioral classification,Treatment methods,Critical thinking,,,,
PSYCH 280,Introduction to Social Psychology,PSYCH,Social psychology,Interpersonal dynamics,Social influence,Prejudice and stereotypes,Attitudes and persuasion,,,,
PSYCH 290,Introduction to the Psychology of Personality,PSYCH,Personality psychology,Personality assessment,Emotional influences,Motivation,Self and culture,,,,
PSYCH 291 / WGS 291,Introduction to the Psychology of Women,PSYCH,Psychology of women,Feminist psychology,Gender and identity,Social categories,Cultural intersectionality,,,,
PSYCH 300,Research Methods Psych NS Special Topics,PSYCH,Research methods,Experimental design,Data analysis,Scientific inquiry,Psychological research,,,,
PSYCH 303,Research Methods in Psychology,PSYCH,Research methods,Psychological research,Laboratory experiments,APA writing,Statistical analysis,,,,
PSYCH 306,Project Outreach Group Leading,PSYCH,Project management,Group facilitation,Experiential learning,Leadership skills,Teaching assistance,,,,
PSYCH 307,Directed Experiences with Children,PSYCH,Child development,Experiential learning,Teaching experience,Youth education,Psychology fieldwork,,,,
PSYCH 310 / ALA 320 / SOC 320,Processes of Intergroup Dialogues Facilitation,PSYCH,Intergroup dialogue,Multicultural interaction,Group facilitation,Social identity,Prejudice and stereotyping,,,,
PSYCH 311 / ALA 321 / EDUC 329 / SOC 321,Practicum in Facilitating Intergroup Dialogues,PSYCH,Intergroup communication,Facilitation skills,Applied psychology,Conflict resolution,Community building,,,,
PSYCH 316 / AAS 331,The World of the Black Child,PSYCH,Black child development,Cultural psychology,Afro-American studies,Early childhood,Identity development,,,,
PSYCH 322,Field Practicum in Research Techniques for Psychology as a Natural Science,PSYCH,Field practicum,Research techniques,Scientific application,Natural science,Psychology research,,,,
PSYCH 324 / ALA 322 / SOC 324,Advanced Practicum in Intergroup Relations,PSYCH,Advanced intergroup relations,Intergroup facilitation,Multicultural communication,Conflict resolution,Community engagement,,,,
PSYCH 325 / AMCULT 321,Detroit Initiative,PSYCH,Community engagement,Detroit-based fieldwork,Cultural psychology,Child and family welfare,Experiential learning,,,,
PSYCH 326,Faculty Directed Early Research for Psychology as a Natural Science,PSYCH,Early research,Instructor-led study,Data collection,Psychological analysis,Research reporting,,,,
PSYCH 331,Experiential Research Methods in Psychology,PSYCH,Laboratory research,Research design,Data analysis,Lab mentorship,Scientific methodology,,,,
PSYCH 335 / LING 336,"Reading: Language, the Brain, and Cognition",PSYCH,Reading science,Cognitive development,Language and cognition,Reading disorders,Visual and auditory processing,,,,
PSYCH 337 / NEURO 337,Hormones and Behavior,PSYCH,Hormonal behavior,Biological psychology,Endocrine system,Stress and aggression,Sexual and parental behavior,,,,
PSYCH 340 / NEURO 340,Topics in Cognition and Cognitive Neuroscience,PSYCH,Cognitive neuroscience,Cognition topics,Current research,Faculty-led discussions,Variable topics,,,,
PSYCH 341,Advanced Laboratory in Cognitive Psychology,PSYCH,Experimental design,Behavioral experiments,Data analysis,Research methods,Psychological reporting,,,,
PSYCH 342,Research Methods in Human Electroencephalography,PSYCH,Electrophysiology,EEG analysis,Brain mapping,Cognitive neuroscience,Lab techniques,,,,
PSYCH 347,Perception,PSYCH,Sensory perception,Visual processing,Signal detection,Conscious vs unconscious,Perceptual biases,,,,
PSYCH 349 / LING 347,Talking Minds,PSYCH,Language processing,Cognitive communication,Comparative linguistics,Animal vs human language,AI communication systems,,,,
PSYCH 352 / LING 352,Development of Language and Thought,PSYCH,Child language development,Phonological skills,Morphosyntax,Cultural influence,Developmental milestones,,,,
PSYCH 353,Social Development,PSYCH,Socialization,Cultural impact,Peer and family influence,Adolescence development,Social learning,,,,
PSYCH 355,Cognitive Development,PSYCH,Cognitive growth,Memory and attention,Problem-solving,Concept development,Cultural differences,,,,
PSYCH 357,Research Methods in Educational and Cross-cultural Contexts,PSYCH,Research methodology,Cross-cultural context,Large-scale data analysis,Educational psychology,Collaborative studies,,,,
PSYCH 358,Psychology of Adolescence,PSYCH,Adolescent psychology,Developmental transitions,Peer and family dynamics,Social challenges,Youth behavior,,,,
PSYCH 362 / ENVIRON 361,The Psychology of Environmental Stewardship,PSYCH,Environmental psychology,Behavior change,Motivational strategies,Sustainable living,Stewardship behavior,,,,
PSYCH 371,Advanced Laboratory in Psychopathology,PSYCH,Psychopathology research,Clinical psychology,Research design,Psychiatric assessment,Psychotherapy outcomes,,,,
PSYCH 373,Child and Adolescent Psychopathology,PSYCH,Child psychopathology,Adolescent mental health,Developmental disorders,Disorder persistence,Risk factors,,,,
PSYCH 375,Health Psychology,PSYCH,Health psychology,Biopsychosocial model,Illness prevention,Health enhancement,Psychological factors,,,,
PSYCH 383,Introduction to Survey Research I,PSYCH,Survey research,Questionnaire design,Sampling methods,Data coding,Survey reporting,,,,
PSYCH 389,Psychology and Law,PSYCH,Psychology and law,Legal psychology,Criminal justice system,Jury dynamics,Expert testimony,,,,
PSYCH 390,Topics in Personality and Social Contexts,PSYCH,Social psychology,Personality topics,Variable topics,Contextual psychology,Behavioral studies,,,,
PSYCH 393,Political Psychology,PSYCH,Political psychology,Political behavior,Ideology and leadership,Conflict and negotiation,Mass media influence,,,,
PSYCH 401,Special Problems in Psychology as a Social Science,PSYCH,Social issues,Psychology problems,Variable topics,Social science focus,Credited research,,,,
PSYCH 402,Special Problems in Psychology as a Natural Science,PSYCH,Natural science problems,Research methods,Cognitive science focus,Variable topics,Psychological analysis,,,,
PSYCH 404,Field Practicum,PSYCH,Field practicum,Applied psychology,Psychology principles,Agency work,Practical experience,,,,
PSYCH 405,Field Practicum in a University Setting,PSYCH,University practicum,Academic setting,Experiential learning,Psychological application,Campus setting,,,,
PSYCH 411 / ALA 429 / SOC 471,IGR Senior Capstone: Social Justice in the Real World,PSYCH,Social justice,Social change strategies,Advocacy and activism,Multicultural teamwork,Justice theory,,,,
PSYCH 413,A History of Modern Psychology,PSYCH,Modern psychology,Cognitive psychology history,Neuroscience origins,Clinical psychology roots,UMich psychology legacy,,,,
PSYCH 420,Faculty Directed Advanced Tutorial Reading for Psychology as a Natural Science,PSYCH,Independent study,Natural science focus,Faculty-directed reading,Proposal and final paper,Advanced tutorial,,,,
PSYCH 421,Faculty Directed Advanced Tutorial Reading for Psychology as a Social Science,PSYCH,Independent study,Social science focus,Faculty-directed reading,Proposal and final paper,Advanced tutorial,,,,
PSYCH 422,Faculty Directed Advanced Research Methods for Psychology,PSYCH,Research methods,Individual research,Faculty-directed study,Proposal and final paper,Research design,,,,
PSYCH 423,Faculty Directed Advanced Research Methods for Psychology Writing,PSYCH,Research methods,Individual research,Writing-intensive,Proposal and final paper,Upper-Level Writing Requirement,,,,
PSYCH 424,Senior Honors Research I for Psychology as a Natural Science,PSYCH,Honors research,Literature review,Research proposal,Natural science focus,Psychology honors program,,,,
PSYCH 426,Senior Honors Research II for Psychology as a Natural Science,PSYCH,Honors thesis,Research implementation,Natural science focus,Psychology honors program,Thesis completion,,,,
PSYCH 428,Senior Thesis I: Research in Psychology/BCN,PSYCH,Senior thesis,Research development,Literature review,Psychology/BCN focus,Senior standing,,,,
PSYCH 429,Senior Thesis II: Research in Psychology/BCN,PSYCH,Senior thesis,Research completion,Thesis writing,Psychology/BCN focus,Senior standing,,,,
PSYCH 439 / NEURO 439,The Developing Brain,PSYCH,Brain development,Embryogenesis,Environmental influence,Central nervous system,Behavioral patterns,,,,
PSYCH 440 / NEURO 440,Advanced Topics in Cognitive Neuroscience,PSYCH,Cognitive neuroscience,Seminar style,Current research topics,Advanced topics,Repeatable for credit,,,,
PSYCH 442 / NEURO 442,The Neuroscience of Perception,PSYCH,Neuroscience of perception,Sensory processing,Perceptual illusions,Brain damage effects,Individual perception,,,,
PSYCH 444 / COGSCI 432 / LING 432 / NEURO 432,Introduction to Neurolinguistics,PSYCH,Neurolinguistics,Language processing,Cognitive neuroscience,Neurological disorders,Developmental language issues,,,,
PSYCH 447,Current Topics in Cognition and Cognitive Neuroscience,PSYCH,Cognition topics,Cognitive neuroscience,Current research,Repeatable for credit,Variable topics,,,,
PSYCH 449,Decision Processes,PSYCH,Decision science,Effective decision-making,Psychology/economics/neuroscience,Real-life application,Interdisciplinary approach,,,,
PSYCH 454 / NEURO 454,Developmental Cognitive Neuroscience,PSYCH,Child learning,Cognitive development,Educational neuroscience,Childhood skills,Developmental focus,,,,
PSYCH 456,Human Infancy,PSYCH,Infant development,Perception/cognition,First three years,Social/emotional development,Developmental psychology,,,,
PSYCH 457,Current Topics in Developmental Psychology,PSYCH,Developmental psychology,Current issues,Variable topics,Repeatable for credit,Psychological growth,,,,
PSYCH 464,Mammalian Social Behavior,PSYCH,Social behavior,Mammalian sociality,Behavioral variation,Despotism/sociality,Comparative psychology,,,,
PSYCH 469 / ANTHRBIO 478,Advanced Primate Behavior,PSYCH,Primate behavior,Behavioral ecology,Non-human primates,Reproduction/cooperation,Cultural transmission,,,,
PSYCH 472,Mental Health and Culture,PSYCH,Cultural mental health,Impact of culture,Psychiatric assessment,Acculturation/healing,Stigma/intervention,,,,
PSYCH 474,Introduction to Behavior Therapy,PSYCH,Behavior therapy,Behavior modification,Abnormal behavior,Theoretical foundations,Adult focus,,,,
PSYCH 475,Traumatic Stress,PSYCH,Traumatic stress,PTSD,symptoms/responses,Trauma definitions,Assessment/intervention,,,,
PSYCH 477,Current Topics in Clinical Psychology,PSYCH,Clinical psychology,Current research,Repeatable for credit,Seminar format,Variable topics,,,,
PSYCH 487,Current Topics in Social Psychology,PSYCH,Social psychology,Current topics,Repeatable for credit,Seminar format,Variable topics,,,,
PSYCH 495,Positive Organizational Psychologuy,PSYCH,Positive psychology,Organizational focus,Workplace well-being,Interpersonal processes,Leadership change,,,,
PSYCH 497,Current Topics in Personality and Social Contexts,PSYCH,Personality/social context,Current research,Repeatable for credit,Seminar format,Variable topics,,,,
PSYCH 532 / ANATOMY 541 / NEURO 532 / PHYSIOL 541,Mammalian Reproductive Physiology,PSYCH,Reproductive physiology,Mammalian focus,Biomedical science,Reproductive biology,Graduate-level content,,,,
PSYCH 571,Advanced Topics in Clinical Psychology,PSYCH,Clinical psychology,Advanced topics,Faculty research,Repeatable for credit,Variable topics,,,,
PUBPOL 201 / POLSCI 325,Systematic Thinking About the Problems of the Day,PUBPOL,Public policy design,Systematic thinking,Social problem analysis,Policy evaluation,Interdisciplinary approach,,,,
PUBPOL 428 / ASIAN 490 / SOC 428,Contemporary China,PUBPOL,Contemporary China,Sociology focus,Cultural/economic overview,Daily life aspects,Political/government analysis,,,,
QMSS 201,Intro to Quantitative Methods in the Social Sciences,QMSS,Quantitative methods,Research design,Data management,Statistical analysis,Ethical data practices,,,,
QMSS 301,Quantitative Social Science Analysis and Big Data,QMSS,Big data analysis,Social science questions,Research methodology,Computer science applications,Statistical tools,,,,
QMSS 395,Special Topics in Quantitative Methods in the Social Sciences,QMSS,Special topics,Quantitative methods,Social science focus,Intermediate level,Research themes,,,,
QMSS 451,QMSS Senior Capstone: Social Science Study Management,QMSS,Project management,Social science study,Capstone experience,Teamwork,Consultant and analyst roles,,,,
QMSS 499,Independent Study,QMSS,Independent study,Faculty mentorship,Self-guided research,Custom projects,One-on-one learning,,,,
RCARTS 210,Introduction to Visual Thinking: Adventures in Creativity,RCARTS,Visual thinking,Creative process,Art analysis,Concept development,Artworks from various disciplines,,,,
RCARTS 250,Printmaking I,RCARTS,Printmaking,Visual inquiry,Artistic expression,Image development,Technical printmaking skills,,,,
RCARTS 260,Photography,RCARTS,Photography,Film-based photography,Visual literacy,Self-expression,Black and white/digital studio,,,,
RCARTS 270,Sculpture I,RCARTS,Sculpture,Accessible techniques,Art-making practices,Hands-on sculpture projects,Studio-based learning,,,,
RCARTS 290,Ceramics I,RCARTS,Ceramics,Forming techniques,Ceramic process,History and science,Studio maintenance,,,,
RCARTS 300 / RCSTP 300,Socially Engaged Visual Art in Prison,RCARTS,Socially engaged arts,Prison workshops,Inmate collaboration,Mass incarceration issues,Visual art production,,,,
RCARTS 334,Special Topics in the Creative Arts,RCARTS,Creative arts topics,Specialized topics,Faculty-driven,One-time and recurring courses,Varied creative fields,,,,
RCARTS 350,Printmaking II,RCARTS,Intermediate printmaking,Advanced techniques,Artistic exploration,Individually designed projects,Refinement of skills,,,,
RCARTS 359,Printmaking III,RCARTS,Advanced printmaking,Screen printing,Mono printing,Block printing,Individually designed projects,,,,
RCARTS 360,Photography II,RCARTS,Advanced photography,Photography application,Cross-disciplinary ideas,Photography problems,Self-directed projects,,,,
RCARTS 369,Photography III,RCARTS,Advanced photography,Photography projects,Skill refinement,Photographic techniques,Individual artistic expression,,,,
RCARTS 370,Sculpture II,RCARTS,Intermediate sculpture,Sculptural forms,Material exploration,Artistic development,Three-dimensional art projects,,,,
RCARTS 379,Sculpture III,RCARTS,Advanced sculpture,Sculptural forms,Material investigation,Individual projects,Skill enhancement in sculpture,,,,
RCARTS 390,Ceramics II,RCARTS,Advanced ceramics,Moldmaking techniques,Ceramic sculpture,Content-driven art,Studio practice in ceramics,,,,
RCARTS 399,Ceramics III,RCARTS,Advanced ceramics,Ceramic medium,Project design,Refined skills,Ceramic techniques application,,,,
RCARTS 407 / ARTDES 407,Ceramics and Ritual: The Object as Protagonist,RCARTS,Ceramics and ritual,Ritual practices,Ceramic objects,Installation or performance,Linking present and past,,,,
RCASL 100,Introduction to Deaf Culture,RCASL,Deaf culture,Deaf culture introduction,American Sign Language,Language and culture link,Introduction to ASL culture,,,,
RCASL 102,Elementary American Sign Language II,RCASL,Elementary ASL,Sign language skills,Basic ASL structures,Past and present conversation,Role playing ASL activities,,,,
RCASL 202,Intermediate American Sign Language II,RCASL,Intermediate ASL,ASL communicative structures,Physical space use,Vocabulary expansion,Conversational ASL interactions,,,,
RCCORE 206,Independent Study,RCCORE,Independent study,Faculty-directed study,Concentration requirements,Independent research,Study depth and quality,,,,
RCCORE 306,Independent Study,RCCORE,Independent study,Faculty-directed study,Concentration requirements,Independent research,Study depth and quality,,,,
RCCORE 307,RC Practicum in College Team Teaching,RCCORE,Practicum in teaching,College teaching experience,Teaching internship,Course management,Internship experience,,,,
RCCORE 308,Directed Peer Tutoring,RCCORE,Peer tutoring,Advanced student tutoring,Discipline-specific pedagogy,Faculty supervision,Tutoring progress meetings,,,,
RCCORE 309,Study Off-Campus,RCCORE,Off-campus study,Study abroad,Experiential learning,Junior standing,Independent experience,,,,
RCCORE 334,Special Topics,RCCORE,Special topics,Varied course topics,Program faculty-led courses,Repeated versions,Course evolution,,,,
RCCORE 489,Honors Independent Research,RCCORE,Honors research,Independent thesis research,Preliminary research,Feasibility study,Honors thesis preparation,,,,
RCCORE 490,Honors Thesis,RCCORE,Honors thesis,Thesis writing,Independent research,Thesis credit,Feasibility determination,,,,
RCCWLIT 220,Narration,RCCWLIT,Narrative writing,Short fiction,Creative writing,Prose fiction,Instructor feedback,,,,
RCCWLIT 221,The Writing of Poetry,RCCWLIT,Poetry writing,Contemporary poetry,Private critique,Writing workshop,Small group discussions,,,,
RCCWLIT 320,Advanced Narration,RCCWLIT,Advanced fiction,Short story writing,Peer feedback,Writing workshop,Instructor meetings,,,,
RCCWLIT 321,Advanced Poetry Writing,RCCWLIT,Advanced poetry,Poetry manuscript,Critical evaluation,Peer review,Instructor feedback,,,,
RCCWLIT 325,Introductory Creative Writing Tutorial,RCCWLIT,Creative writing,Individualized instruction,Writing progress,Constructive criticism,Private meetings,,,,
RCCWLIT 326,Intermediate Creative Writing Tutorial,RCCWLIT,Intermediate writing,Tutorial instruction,Writing development,Advanced critique,Private meetings,,,,
RCCWLIT 331,"Literary Monsters: Power, Culture, and the Meanings of Monstrosity",RCCWLIT,Literary analysis,Monster studies,Power and culture,Folklore analysis,Social anxieties,,,,
RCCWLIT 334,Special Topics in Creative Writing,RCCWLIT,Creative writing,Varied writing topics,Faculty-led courses,Writing exploration,Regular offerings,,,,
RCCWLIT 335,Special Topics in Creative Writing and the Humanities,RCCWLIT,Creative writing,Writing craft,Interactive seminar,Literary analysis,Fiction and poetry,,,,
RCCWLIT 425,Tutorial for Creative Writing Majors,RCCWLIT,Creative writing,Writing tutorial,Instructor feedback,Individualized progress,Credit-based instruction,,,,
RCCWLIT 426,Advanced Creative Writing Tutorial,RCCWLIT,Advanced writing,Tutorial instruction,Individualized feedback,Advanced writing techniques,Writing progress,,,,
RCDRAMA 102,First Year Seminar in Drama (Creative Expression),RCDRAMA,Drama fundamentals,Acting techniques,Theatrical expression,Script analysis,Interactive seminar,,,,
RCDRAMA 281,Inside the Dramatic Experience: Script Analysis and the Elements of Theater Production,RCDRAMA,Theater production,Role preparation,Character building,Vocal techniques,Ensemble collaboration,,,,
RCDRAMA 387,Renaissance Drama,RCDRAMA,Renaissance drama,Playwrights analysis,Theatrical history,Period styles,European theatre,,,,
RCDRAMA 389,The Modern Theatre,RCDRAMA,Modern theatre,Drama development,National theatre,Performance history,Theatrical themes,,,,
RCDRAMA 482,Drama Interpretation II: Director and Text,RCDRAMA,Directing techniques,Creative collaboration,Staging exercises,Actor work,One-act play production,,,,
RCDRAMA 485,Special Drama Topics,RCDRAMA,Drama topics,Specialized courses,Upper-class focus,Drama exploration,Thematic studies,,,,
RCHUMS 150 / FTVM 150,"Introduction to Film, Television, and Media",RCHUMS,Film and media analysis,Critical vocabulary,Audiovisual essays,Media literacy,Editing skills,,,,
RCHUMS 201,How to Think (Humanities),RCHUMS,Humanities thinking,Art forms inquiry,Disciplinary thought,Philosophical analysis,Conceptual study,,,,
RCHUMS 202,How to Think (Arts),RCHUMS,Arts thinking,Art form inquiry,Practitioner's perspective,Creative practice,Artistic discipline,,,,
RCHUMS 235,Topics in World Dance,RCHUMS,World dance traditions,Cultural dance comparison,Theatrical dance,Social dance practices,Guest artist lectures,,,,
RCHUMS 291,The Experience of Arts and Ideas in the Nineteenth Century,RCHUMS,Nineteenth-century art,Artistic ideas,Period analysis,Cultural movements,Art history,,,,
RCHUMS 304,"Time, History, Arts, and Culture",RCHUMS,History through arts,Philosophy of time,Interdisciplinary approach,Art and culture case studies,Philosophical framework,,,,
RCHUMS 306,History of Writing in the West: The Book and the Body,RCHUMS,Writing history,Writing technologies,Reading practices,Western writing history,Cultural dialogue,,,,
RCHUMS 309 / MEMS 309,The Middle Ages and the Modern World,RCHUMS,Medieval to modern culture,Ancient roots,Contemporary culture,Art and history connections,Pre-modern societies,,,,
RCHUMS 315,Representation in the Arts,RCHUMS,Arts representation,Artistic portrayals,Peoples and places,Ideas in art,Artistic interpretations,,,,
RCHUMS 333,Art and Culture,RCHUMS,Art and culture interaction,Artistic theories,Cultural mechanics,Political art function,Art criticism,,,,
RCHUMS 334,Special Topics in the Humanities,RCHUMS,Humanities special topics,Varied art topics,Faculty-led courses,Course evolution,Interdisciplinary studies,,,,
RCHUMS 341 / AMCULT 391 / RCSTP 341,Community Empowerment Through the Arts,RCHUMS,Community empowerment,Arts for social justice,Social change through arts,Engaged learning,Internship-based learning,,,,
RCIDIV 272 / HISTART 272,Modern Art: Avant-Garde to Contemporary,RCIDIV,20th-century art,Avant-garde art,Signification theory,Revolutionary politics,Art history analysis,,,,
RCIDIV 273 / ASIAN 273,North Korea: Real and Imagined,RCIDIV,North Korea studies,International relations,Historical perspectives,Contemporary society,Political analysis,,,,
RCIDIV 350,Special Topics,RCIDIV,Special topics,Specialized themes,Varied subjects,Credit/no credit,Variable course focus,,,,
RCIDIV 351,Special Topics,RCIDIV,Special topics,Specialized themes,Varied subjects,Credit/no credit,Variable course focus,,,,
RCIDIV 391 / ENVIRON 391 / ORGSTUDY 391,Sustainability and the Campus,RCIDIV,Sustainability on campus,Environmental sustainability,Campus projects,Project-based learning,Sustainability practices,,,,
RCLANG 190,Intensive French I,RCLANG,Intensive French,Basic grammar and syntax,French culture,Communication skills,Language proficiency,,,,
RCLANG 194,Intensive Spanish I,RCLANG,Intensive Spanish,Basic grammar and syntax,Spanish culture,Communication skills,Language proficiency,,,,
RCLANG 290,Intensive French II,RCLANG,Intensive French,Basic grammar and syntax,French culture,Communication skills,Language proficiency,,,,
RCLANG 291,Intensive German II,RCLANG,Intensive German,Vocabulary expansion,Grammar mastery,Proficiency exam,Language competency,,,,
RCLANG 293,Intensive Russian II,RCLANG,Intensive Russian,Vocabulary expansion,Grammar mastery,Proficiency exam,Language competency,,,,
RCLANG 294,Intensive Spanish II,RCLANG,Intensive Spanish,Basic grammar and syntax,Spanish culture,Communication skills,Language proficiency,,,,
RCLANG 296,Intensive Japanese II,RCLANG,Intensive Japanese,Grammar and Kanji,"Oral, reading, and writing skills",Language proficiency,Japanese culture,,,,
RCLANG 310,Accelerated Review-French,RCLANG,French readings,"Literature, philosophy, culture",Language application,Student participation,Advanced language skills,,,,
RCLANG 320,Readings in French,RCLANG,French readings,"Literature, culture, politics",Discussion-based learning,Language proficiency,Advanced language skills,,,,
RCLANG 324,Readings in Spanish,RCLANG,Spanish readings,"Literature, culture, politics",Discussion-based learning,Language proficiency,Advanced language skills,,,,
RCMUSIC 254,The Art and Technique of Singing,RCMUSIC,Vocal technique,Public performance,Artistic expression,Healthy singing,Voice training,,,,
RCMUSIC 320,Chamber Music,RCMUSIC,Small ensemble performance,Vocal or instrumental music,Repertoire selection,Artistic collaboration,Chamber performance,,,,
RCMUSIC 321,Chinese Music Ensemble,RCMUSIC,Chinese musical instruments,Cultural learning,Historical context,Interactive music making,Traditional music,,,,
RCMUSIC 323 / ENS 351,Arts Chorale,RCMUSIC,Vocal ensemble,Choral performance,Audition-based,Community music,Singing techniques,,,,
RCMUSIC 325 / ENS 307,Global Performance Ensemble,RCMUSIC,Cross-cultural music performance,Ensemble collaboration,World music styles,Performance requirements,Cultural exchange,,,,
RCMUSIC 350,Creative Musicianship,RCMUSIC,Music theory and composition,Personal expression,Composition skills,Musical creativity,Original works,,,,
RCMUSIC 351,Creative Musicianship Music Theory Lab,RCMUSIC,Music theory and ear training,Application through music making,Complementary to composition,Creative musicianship,Musical analysis,,,,
RCMUSIC 352,"Found Instruments-Building, Design and Performance",RCMUSIC,Instrument building and design,Found objects as instruments,Improvisation and composition,Ensemble performance,Experimental music,,,,
RCMUSIC 406,Music Independent Study,RCMUSIC,Independent music projects,Faculty-guided study,Personal music exploration,Research-based learning,Autonomous learning,,,,
